{
  "event_id": "evt_01HZYT000000000000000001",
  "session_id": "sess_01HZYT000000000000000001",
  "turn_id": "turn_01HZYT000000000000000001",
  "trace_id": "trace_01HZYT000000000000000001",
  "request_id": "req_01HZYT000000000000000001",
  "type": "state.transition",
  "timestamp": "2026-06-01T00:00:00Z",
  "data": {
    "from": "waiting_user",
    "to": "detecting_intent"
  }
}
