{
  "event_id": "evt_01HZYT000000000000000004",
  "session_id": "sess_01HZYT000000000000000001",
  "turn_id": "turn_01HZYT000000000000000001",
  "trace_id": "trace_01HZYT000000000000000001",
  "request_id": "req_01HZYT000000000000000001",
  "type": "tool.done",
  "timestamp": "2026-06-01T00:00:02Z",
  "data": {
    "tool_call_id": "tc_01HZYT000000000000000001",
    "tool_name": "summarize_page",
    "status": "succeeded"
  }
}
